"UPDATED","ENTRY_DATE","EVENT_LCL_DATE","EVENT_LCL_TIME","LOC_CITY_NAME","LOC_STATE_NAME","LOC_CNTRY_NAME","RMK_TEXT","EVENT_TYPE_DESC","FSDO_DESC","REGIST_NBR","FLT_NBR","ACFT_OPRTR","ACFT_MAKE_NAME","ACFT_MODEL_NAME","ACFT_MISSING_FLAG","ACFT_DMG_DESC","FLT_ACTIVITY","FLT_PHASE","FAR_PART","MAX_INJ_LVL","FATAL_FLAG","FLT_CRW_INJ_NONE","FLT_CRW_INJ_MINOR","FLT_CRW_INJ_SERIOUS","FLT_CRW_INJ_FATAL","FLT_CRW_INJ_UNK","CBN_CRW_INJ_NONE","CBN_CRW_INJ_MINOR","CBN_CRW_INJ_SERIOUS","CBN_CRW_INJ_FATAL","CBN_CRW_INJ_UNK","PAX_INJ_NONE","PAX_INJ_MINOR","PAX_INJ_SERIOUS","PAX_INJ_FATAL","PAX_INJ_UNK","GRND_INJ_NONE","GRND_INJ_MINOR","GRND_INJ_SERIOUS","GRND_INJ_FATAL","GRND_INJ_UNK"
"No","30-JUN-25","28-JUN-25","16:35:00Z","CAPRON","ILLINOIS","UNITED STATES","AIRCRAFT CRASHED UNDER UNKNOWN CIRCUMSTANCES, CAPRON, IL.","ACCIDENT","GREATER CHICAGO FSDO","N847CS","","","VANS","RV10","No","SUBSTANTIAL","PERSONAL","EN ROUTE (ENR)","91","FATAL","Yes","0","0","0","1","0","0","0","0","0","0","0","0","0","1","0","0","0","0","0","0"
"No","24-JUN-25","19-JUN-25","14:40:00Z","HURON","SOUTH DAKOTA","UNITED STATES","AIRCRAFT CRASHED IN A FIELD, HURON, SD.","ACCIDENT","RAPID CITY FSDO","N6174A","","","PIPER","PA36","No","DESTROYED","AERIAL APPLICATION","MANEUVERING (MNV)","137","NONE","No","1","0","0","0","0","0","0","0","0","0","0","0","0","0","0","0","0","0","0","0"
"No","24-JUN-25","23-JUN-25","13:51:00Z","SWANZEY","NEW HAMPSHIRE","UNITED STATES","AIRCRAFT CRASHED FOR UNKNOWN REASONS, SWANZEY, NH.","INCIDENT","PORTLAND ME FSDO","N62XF","","","GYRO TECHNIC","GT-VX2","No","UNKNOWN","PERSONAL","UNKNOWN (UNK)","91","MINOR","No","0","1","0","0","0","0","0","0","0","0","0","0","0","0","0","0","0","0","0","0"
"No","24-JUN-25","20-JUN-25","06:00:00Z","BURBANK","CALIFORNIA","UNITED STATES","AIRCRAFT ABORTED TAKEOFF DUE TO A BAGGAGE FIRE AND FIRE WAS EXTINGUISHED, BURBANK, CA.","INCIDENT","VAN NUYS FSDO","N149WW","","","CESSNA","525","No","MINOR","AMBULANCE","TAKEOFF (TOF)","135","NONE","No","2","0","0","0","0","2","0","0","0","0","1","0","0","0","0","0","0","0","0","0"
"No","30-JUN-25","21-JUN-25","22:00:00Z","MIDLOTHIAN","TEXAS","UNITED STATES","AIRCRAFT LANDED HARD DAMAGING NOSE AND MAIN GEARS, MIDLOTHIAN, TX.","ACCIDENT","NORTH TEXAS FSDO","N852BG","","","BURKHART GROB","G-103A TWIN II ACRO","No","SUBSTANTIAL","PERSONAL","LANDING (LDG)","91","NONE","No","1","0","0","0","0","0","0","0","0","0","0","0","0","0","0","0","0","0","0","0"
"No","30-JUN-25","29-JUN-25","19:30:00Z","NEPHI","UTAH","UNITED STATES","AIRCRAFT ON LANDING AND NOSE GEAR BROKE OFF, NEPHI, UT.","ACCIDENT","SALT LAKE CITY FSDO","N3608U","","","CESSNA","182","No","SUBSTANTIAL","PERSONAL","LANDING (LDG)","91","NONE","No","1","0","0","0","0","0","0","0","0","0","0","0","0","0","0","0","0","0","0","0"
"No","30-JUN-25","28-JUN-25","21:20:00Z","TRACY","CALIFORNIA","UNITED STATES","AIRCRAFT ON A SOFT-FIELD TAKEOFF, BANKED HARD TO THE LEFT AS IT BECAME AIRBORNE AND CRASHED ON THE RUNWAY, TRACY, CA.","ACCIDENT","OAKLAND FSDO","N6744F","","","CESSNA","150","No","SUBSTANTIAL","PERSONAL","TAKEOFF (TOF)","91","NONE","No","1","0","0","0","0","0","0","0","0","0","0","0","0","0","0","0","0","0","0","0"
"No","30-JUN-25","29-JUN-25","01:25:00Z","PICNIC HARBOR","ALASKA","UNITED STATES","AIRCRAFT LANDING ON THE BEACH AND FLIPPED OVER, PICNIC HARBOR, AK.","ACCIDENT","ANCHORAGE FSDO","N8085L","","","CESSNA","172","No","SUBSTANTIAL","PERSONAL","LANDING (LDG)","91","NONE","No","1","0","0","0","0","0","0","0","0","0","2","0","0","0","0","0","0","0","0","0"
"No","30-JUN-25","29-JUN-25","14:10:00Z","EUSTIS","FLORIDA","UNITED STATES","AIRCRAFT STRUCK TREES ON DEPARTURE AND CRASHED INTO A POND, EUSTIS, FL.","ACCIDENT","ORLANDO FSDO","N9420Y","","","BEECH","95-B55","No","SUBSTANTIAL","PERSONAL","TAKEOFF (TOF)","91","UNKNOWN","No","0","0","0","0","1","0","0","0","0","0","0","0","0","0","1","0","0","0","0","0"
"No","24-JUN-25","23-JUN-25","13:42:00Z","MONTROSE","COLORADO","UNITED STATES","AIRCRAFT CRASHED UNDER UNKNOWN CIRCUMSTANCES AFTER TAKEOFF AND POST CRASH FIRE, MONTROSE, CO.","ACCIDENT","SALT LAKE CITY FSDO","N250MK","","","EXPERIMEN TAL","BEARHAWK BEAR","No","UNKNOWN","PERSONAL","INITIAL CLIMB (ICL)","91","FATAL","Yes","0","0","0","1","0","0","0","0","0","0","0","0","0","1","0","0","0","0","0","0"
"No","24-JUN-25","23-JUN-25","19:17:00Z","MORGAN HILL","CALIFORNIA","UNITED STATES","AIRCRAFT EXPERIENCED ENGINE ISSUES AND CRASHED IN A FIELD, MORGAN HILL, CA.","ACCIDENT","SAN JOSE FSDO","N696WG","","","VANS","RV9","No","SUBSTANTIAL","PERSONAL","EN ROUTE (ENR)","91","MINOR","No","0","1","0","0","0","0","0","0","0","0","0","0","0","0","0","0","0","0","0","0"
"No","24-JUN-25","23-JUN-25","14:35:00Z","MILTON","FLORIDA","UNITED STATES","AIRCRAFT LOST POWER ON TAKEOFF AND CRASHED PAST THE DEPARTURE END OF THE RUNWAY, MILTON, FL.","INCIDENT","ALABAMA AND NW FLORIDA FSDO","N262AL","","","CESSNA","R182","No","UNKNOWN","PERSONAL","TAKEOFF (TOF)","91","NONE","No","1","0","0","0","0","0","0","0","0","0","0","0","0","0","0","0","0","0","0","0"
"No","25-JUN-25","24-JUN-25","12:15:00Z","PIERRE","SOUTH DAKOTA","UNITED STATES","AIRCRAFT STRUCK POWER LINE AND CRASHED IN A FIELD, PIERRE, SD.","ACCIDENT","RAPID CITY FSDO","N107ML","","","AIR TRACTOR","AT402","No","SUBSTANTIAL","AERIAL APPLICATION","MANEUVERING (MNV)","137","MINOR","No","0","1","0","0","0","0","0","0","0","0","0","0","0","0","0","0","0","0","0","0"
"No","25-JUN-25","24-JUN-25","20:41:00Z","PENDLETON","OREGON","UNITED STATES","AIRCRAFT ENCOUNTERED CROSSWIND ON LANDING, BOUNCED AND VEERED OFF RUNWAY, PENDLETON, OR.","ACCIDENT","PORTLAND FSDO","N2051U","","","MAULE","M4","No","SUBSTANTIAL","PERSONAL","LANDING (LDG)","91","NONE","No","1","0","0","0","0","0","0","0","0","0","2","0","0","0","0","0","0","0","0","0"
"No","25-JUN-25","24-JUN-25","17:34:00Z","BIG LAKE","ALASKA","UNITED STATES","AIRCRAFT CRASHED UNDER UNKNOWN CIRCUMSTANCES, BIG LAKE, AK.","ACCIDENT","ANCHORAGE FSDO","N3609Q","","","PIPER","PA32R","No","SUBSTANTIAL","PERSONAL","EN ROUTE (ENR)","91","SERIOUS","No","0","0","1","0","0","0","0","0","0","0","0","0","1","0","0","0","0","0","0","0"
"No","30-JUN-25","27-JUN-25","16:15:00Z","KELLEYS ISLAND","OHIO","UNITED STATES","AIRCRAFT PORPOISED ON TAKEOFF,  VEERED OFF RUNWAY AND NOSE GEAR COLLAPSED, KELLEYS ISLAND, OH.","ACCIDENT","CLEVELAND FSDO","N30743","","","CESSNA","177","No","SUBSTANTIAL","PERSONAL","TAKEOFF (TOF)","91","MINOR","No","0","1","0","0","0","0","0","0","0","0","0","1","0","0","0","0","0","0","0","0"
"No","30-JUN-25","30-JUN-25","04:05:00Z","KNIK RIVER","ALASKA","UNITED STATES","AIRCRAFT ROLLED OVER ON LANDING, KNIK RIVER, AK.","ACCIDENT","ANCHORAGE FSDO","N531AT","","","ROBINSON","R44","No","SUBSTANTIAL","SIGHT SEEING","LANDING (LDG)","135","NONE","No","1","0","0","0","0","0","0","0","0","0","3","0","0","0","0","0","0","0","0","0"
"No","25-JUN-25","24-JUN-25","18:15:00Z","FAYETTEVILLE","TENNESSEE","UNITED STATES","AIRCRAFT EXPERIENCED INSUFFICIENT POWER ON TAKEOFF AND CRASH LANDED IN THE GRASS PAST THE END OF THE RUNWAY, FAYETTEVILLE, TN.","ACCIDENT","NASHVILLE FSDO","N5045Q","","","CESSNA","310","No","SUBSTANTIAL","PERSONAL","TAKEOFF (TOF)","91","NONE","No","1","0","0","0","0","0","0","0","0","0","0","0","0","0","0","0","0","0","0","0"
"No","25-JUN-25","24-JUN-25","20:48:00Z","DUNLAP","TENNESSEE","UNITED STATES","AIRCRAFT CRASHED UNDER UNKNOWN CIRCUMSTANCES, DUNLAP, TN.","ACCIDENT","NASHVILLE FSDO","N28DR","","","PIPER","J3C-65","No","UNKNOWN","PERSONAL","UNKNOWN (UNK)","91","FATAL","Yes","0","0","0","1","0","0","0","0","0","0","0","0","1","0","0","0","0","0","0","0"
"No","25-JUN-25","24-JUN-25","16:30:00Z","BATTLE CREEK","MICHIGAN","UNITED STATES","AIRCRAFT NOSE GEAR COLLAPSED ON LANDING, BATTLE CREEK, MI.","INCIDENT","GRAND RAPIDS FSDO","N14LE","","","RUTAN","LONG-EZ","No","UNKNOWN","PERSONAL","LANDING (LDG)","91","NONE","No","1","0","0","0","0","0","0","0","0","0","0","0","0","0","0","0","0","0","0","0"
"No","30-JUN-25","27-JUN-25","20:08:00Z","SANTA BARBARA","CALIFORNIA","UNITED STATES","AIRCRAFT LANDED, TURNED TOO QUICKLY AND THE LEFT WING STRUCK A TAXIWAY SIGN, SANTA BARBARA, CA.","ACCIDENT","VAN NUYS FSDO","N307BE","","","ALEXANDER SCHLEICHER GMBH","ASH 30 MI","No","SUBSTANTIAL","PERSONAL","LANDING (LDG)","91","NONE","No","1","0","0","0","0","0","0","0","0","0","0","0","0","0","0","0","0","0","0","0"
"No","30-JUN-25","29-JUN-25","14:49:00Z","ZEELAND","MICHIGAN","UNITED STATES","AIRCRAFT CRASHED UNDER UNKNOWN CIRCUMSTANCES SHORTLY AFTER TAKEOFF, ZEELAND, MI.","ACCIDENT","GRAND RAPIDS FSDO","N360RF","","","LANCAIR","320/360","No","DESTROYED","PERSONAL","TAKEOFF (TOF)","91","FATAL","Yes","0","0","0","1","0","0","0","0","0","0","0","0","0","0","0","0","0","0","0","0"
"No","30-JUN-25","29-JUN-25","08:36:00Z","YOUNGSTOWN","OHIO","UNITED STATES","AIRCRAFT CRASHED UNDER UNKNOWN CIRCUMSTANCES, YOUNGSTOWN, OH.","ACCIDENT","CLEVELAND FSDO","N441LS","","","CESSNA","441","No","DESTROYED","PERSONAL","INITIAL CLIMB (ICL)","91","FATAL","Yes","0","0","0","1","0","0","0","0","0","0","0","0","0","5","0","0","0","0","0","0"
"No","30-JUN-25","30-JUN-25","02:55:00Z","HELENA","MONTANA","UNITED STATES","AIRCRAFT LANDED AND GROUND LOOPED, HELENA, MT.","ACCIDENT","HELENA FSDO","N50476","","","BELLANCA","7GCBC","No","SUBSTANTIAL","PERSONAL","LANDING (LDG)","91","NONE","No","1","0","0","0","0","0","0","0","0","0","0","0","0","0","0","0","0","0","0","0"
"No","30-JUN-25","28-JUN-25","19:45:00Z","PRIEST LAKE","IDAHO","UNITED STATES","AIRCRAFT CRASHED AND BECAME INVERTED IN THE WATER, PRIEST LAKE, ID.","ACCIDENT","SPOKANE FSDO","N6759K","","","REPUBLIC","RC-3","No","SUBSTANTIAL","PERSONAL","TAKEOFF (TOF)","91","NONE","No","1","0","0","0","0","0","0","0","0","0","1","0","0","0","0","0","0","0","0","0"
"No","03-JUL-25","02-JUL-25","20:13:00Z","MOUNT VERNON","WASHINGTON","UNITED STATES","AIRCRAFT CRASHED UNDER UNKNOWN CIRCUMSTANCES ON DEPARTURE, MOUNT VERNON, WA.","ACCIDENT","SEATTLE FSDO","N774RS","","","EVOLUTION AIRCRAFT","REVOLT","No","UNKNOWN","PERSONAL","TAKEOFF (TOF)","91","FATAL","Yes","0","0","0","1","0","0","0","0","0","0","0","0","0","0","0","0","0","0","0","0"
"No","03-JUL-25","02-JUL-25","18:00:00Z","GALLATIN","TENNESSEE","UNITED STATES","AIRCRAFT CRASHED IN A FIELD UNDER UNKNOWN CIRCUMSTANCES, GALLATIN, TN.","ACCIDENT","NASHVILLE FSDO","N93985","","","ERCOUPE","415-C","No","UNKNOWN","PERSONAL","EN ROUTE (ENR)","91","FATAL","Yes","0","0","0","1","0","0","0","0","0","0","0","0","0","0","0","0","0","0","0","0"
"No","03-JUL-25","02-JUL-25","19:56:00Z","CROSS KEYS","NEW JERSEY","UNITED STATES","AIRCRAFT EXPERIENCED ENGINE ISSUES AFTER DEPARTURE AND CRASHED WHILE RETURNING TO THE AIRPORT AFTER A RUNWAY EXCURSION INTO TREES, CROSS KEYS, NJ.","ACCIDENT","PHILADELPHIA FSDO","N716MM","","","CESSNA","208","No","UNKNOWN","SKYDIVING","TAKEOFF (TOF)","91","SERIOUS","No","0","0","0","0","1","0","0","0","0","0","1","0","3","0","10","0","0","0","0","0"
"No","03-JUL-25","02-JUL-25","16:06:00Z","RALEIGH-DURHAM","NORTH CAROLINA","UNITED STATES","AIRCRAFT LANDED AND POST FLIGHT INSPECTION REVEALED PART OF A FLAP WAS MISSING FROM A WING, RALEIGH-DURHAM, NC.","INCIDENT","GREENSBORO FSDO","N875DN","DAL3247","DELTA AIRLINES","BOEING","737","No","UNKNOWN","COMMERCIAL","EN ROUTE (ENR)","121","NONE","No","0","0","0","0","0","0","0","0","0","0","0","0","0","0","0","0","0","0","0","0"
"No","03-JUL-25","30-JUN-25","19:40:00Z","SEATTLE","WASHINGTON","UNITED STATES","AIRCRAFT LANDED HARD, SEATTLE, WA.","INCIDENT","SEATTLE FSDO","N23UP","","","ROBINSON","R66","No","UNKNOWN","PERSONAL","LANDING (LDG)","","NONE","No","1","0","0","0","0","0","0","0","0","0","1","0","0","0","0","0","0","0","0","0"
"No","03-JUL-25","02-JUL-25","16:55:00Z","GRANTS","NEW MEXICO","UNITED STATES","AIRCRAFT EXPERIENCED ENGINE ISSUES AFTER TAKEOFF AND RETURNED TO AIRPORT, WHILE LANDING VEERED OFF RUNWAY, GRANTS, NM.","INCIDENT","ALBUQUERQUE FSDO","N451Z","","","REPUBLIC","RC-3","No","UNKNOWN","PERSONAL","TAKEOFF (TOF)","91","NONE","No","1","0","0","0","0","0","0","0","0","0","0","0","0","0","0","0","0","0","0","0"
"No","03-JUL-25","02-JUL-25","17:40:00Z","MESQUITE","TEXAS","UNITED STATES","AIRCRAFT INCURRED A PROP STRIKE ON LANDING,  MESQUITE, TX.","INCIDENT","NORTH TEXAS FSDO","N3622A","","","BEECH","E-55","No","UNKNOWN","INSTRUCTION","LANDING (LDG)","91","NONE","No","1","0","0","0","0","0","0","0","0","0","1","0","0","0","0","0","0","0","0","0"
"No","03-JUL-25","02-JUL-25","19:15:00Z","NEW YORK","NEW YORK","UNITED STATES","AIRCRAFT EXPERIENCED A CROSSWIND ON DEPARTURE AND CAME TO A STOP ON THE NOSE, NEW YORK, NY.","INCIDENT","NEW YORK FSDO","N6824H","","","PIPER","J3C-65","No","UNKNOWN","PERSONAL","TAKEOFF (TOF)","91","NONE","No","1","0","0","0","0","0","0","0","0","0","1","0","0","0","0","0","0","0","0","0"
"No","03-JUL-25","02-JUL-25","17:50:00Z","BRUSH","COLORADO","UNITED STATES","AIRCRAFT LOST CONTROL ON LANDING AND VEERED OFF RUNWAY COMING TO REST ON LEFT WINGTIP ON AN EMBANKMENT, BRUSH, CO.","INCIDENT","DENVER FSDO","N7635H","","","PIPER","PA12","No","UNKNOWN","PERSONAL","LANDING (LDG)","91","NONE","No","1","0","0","0","0","0","0","0","0","0","0","0","0","0","0","0","0","0","0","0"
"No","03-JUL-25","02-JUL-25","23:20:00Z","MADISONVILLE","KENTUCKY","UNITED STATES","AIRCRAFT LOST CONTROL AND CRASHED ON THE HELIPAD FOR UNKNOWN REASONS AND CAME TO REST ON ITS SIDE, MADISONVILLE, KY.","INCIDENT","LOUISVILLE FSDO","N21385","","","SCHWEIZER","269C-1","No","UNKNOWN","INSTRUCTION","LANDING (LDG)","91","NONE","No","1","0","0","0","0","0","0","0","0","0","0","0","0","0","0","0","0","0","0","0"
"No","30-JUN-25","27-JUN-25","11:00:00Z","COVINGTON","KENTUCKY","UNITED STATES","AIRCRAFT STRUCK A BIRD DAMAGING PITOT TUBE, COVINGTON, KY.","INCIDENT","CINCINNATI FSDO","N295NV","AAY393","ALLEGIANT AIR","AIRBUS","A320","No","MINOR","COMMERCIAL","TAKEOFF (TOF)","121","NONE","No","0","0","0","0","0","0","0","0","0","0","0","0","0","0","0","0","0","0","0","0"
"No","03-JUL-25","02-JUL-25","17:05:00Z","RIVERSIDE","CALIFORNIA","UNITED STATES","AIRCRAFT PORPOISED ON LANDING, RIVERSIDE, CA.","INCIDENT","RIVERSIDE FSDO","N76901","","","CESSNA","172","No","UNKNOWN","INSTRUCTION","LANDING (LDG)","91","NONE","No","1","0","0","0","0","0","0","0","0","0","0","0","0","0","0","0","0","0","0","0"
"No","03-JUL-25","02-JUL-25","20:13:00Z","CONCORD","CALIFORNIA","UNITED STATES","AIRCRAFT STRUCK A BIRD LEAVING A DENT IN THE LEADING EDGE OF RIGHT WING, CONCORD, CA.","INCIDENT","OAKLAND FSDO","N98436","","","CESSNA","172R","No","UNKNOWN","PERSONAL","APPROACH (APR)","91","NONE","No","0","0","0","0","0","0","0","0","0","0","0","0","0","0","0","0","0","0","0","0"
"No","03-JUL-25","01-JUL-25","13:45:00Z","RIDGELY","MISSOURI","UNITED STATES","AIRCRAFT CRASHED UNDER UNKNOWN CIRCUMSTANCES, RIDGELY, MO.","INCIDENT","KANSAS CITY FSDO","N16726","","","BELL","206","No","UNKNOWN","AERIAL APPLICATION","UNKNOWN (UNK)","137","NONE","No","1","0","0","0","0","0","0","0","0","0","0","0","0","0","0","0","0","0","0","0"
"No","27-JUN-25","26-JUN-25","03:28:00Z","MEEKER","COLORADO","UNITED STATES","AIRCRAFT CRASHED UNDER UNKNOWN CIRCUMSTANCES, MEEKER, CO.","ACCIDENT","SALT LAKE CITY FSDO","N411WJ","","","MD HELICOPTERS","369","No","UNKNOWN","PERSONAL","EN ROUTE (ENR)","91","FATAL","Yes","0","0","0","1","0","0","0","0","0","0","0","0","0","0","0","0","0","0","0","0"
"No","27-JUN-25","26-JUN-25","13:30:00Z","NAHUNTA","GEORGIA","UNITED STATES","AIRCRAFT CAUGHT FIRE DURING START-UP AND FIRE DEPARTMENT EXTINGUISHED THE FIRE, NAHUNTA, GA.","ACCIDENT","ATLANTA FSDO","N4953N","","","CESSNA","182","No","SUBSTANTIAL","PERSONAL","STANDING (STD)","91","NONE","No","1","0","0","0","0","0","0","0","0","0","0","0","0","0","0","0","0","0","0","0"
"No","27-JUN-25","26-JUN-25","14:40:00Z","DAYTON","OHIO","UNITED STATES","AIRCRAFT LANDED LONG AND OVERRAN THE RUNWAY INTO THE GRASS, DAYTON, OH.","INCIDENT","CINCINNATI FSDO","N405BS","","","CESSNA","750","No","UNKNOWN","PERSONAL","LANDING (LDG)","91","NONE","No","1","0","0","0","0","0","0","0","0","0","3","0","0","0","0","0","0","0","0","0"
"No","27-JUN-25","26-JUN-25","14:00:00Z","MOUNT GILEAD","OHIO","UNITED STATES","AIRCRAFT VEERED OFF THE END OF RUNWAY FOR UNKNOWN REASONS, MOUNT GILEAD, OH.","INCIDENT","COLUMBUS FSDO","N3619J","","","CESSNA","T188","No","UNKNOWN","AERIAL APPLICATION","UNKNOWN (UNK)","137","MINOR","No","0","1","0","0","0","0","0","0","0","0","0","0","0","0","0","0","0","0","0","0"
"No","27-JUN-25","27-JUN-25","02:48:00Z","KERNVILLE","CALIFORNIA","UNITED STATES","AIRCRAFT DEPARTED AND SHORTLY AFTER, A  BEARING IN THE ROTOR BLEW OUT AND MADE A PRECAUTIONARY LANDING NEAR LAKE ISABELLA, KERNVILLE, CA.","INCIDENT","FRESNO FSDO","N755BF","","","ENSTROM","280FX","No","UNKNOWN","PERSONAL","TAKEOFF (TOF)","91","NONE","No","1","0","0","0","0","0","0","0","0","0","1","0","0","0","0","0","0","0","0","0"
"No","27-JUN-25","27-JUN-25","02:56:00Z","MOBILE","ALABAMA","UNITED STATES","AIRCRAFT ABORTED TAKEOFF DUE TO A CARGO DOOR OPENING, TAXIED TO THE RAMP AND POST FLIGHT INSPECTION REVEALED DAMAGE TO THE CARGO DOOR, MOBILE, AL.","INCIDENT","ALABAMA AND NW FLORIDA FSDO","N208LS","","","CESSNA","208","No","UNKNOWN","PERSONAL","TAKEOFF (TOF)","91","NONE","No","1","0","0","0","0","0","0","0","0","0","0","0","0","0","0","0","0","0","0","0"
"No","30-JUN-25","25-JUN-25","02:00:00Z","KANTISHNA","ALASKA","UNITED STATES","AIRCRAFT GEAR COLLAPSED AFTER HITTING A DIP, KANTISHNA, AK.","INCIDENT","ANCHORAGE FSDO","N2655D","","","CESSNA","170","No","UNKNOWN","PERSONAL","LANDING (LDG)","91","NONE","No","1","0","0","0","0","0","0","0","0","0","0","0","0","0","0","0","0","0","0","0"
"No","30-JUN-25","26-JUN-25","17:19:00Z","SWEETWATER","TEXAS","UNITED STATES","AIRCRAFT LANDED AND VEERED OFF RUNWAY DUE TO WINDS DAMAGING THE LEFT WING, TAIL AND LANDING GEAR, SWEETWATER, TX.","INCIDENT","LUBBOCK FSDO","N2300A","","","PIPER","PA22","No","UNKNOWN","PERSONAL","LANDING (LDG)","91","NONE","No","1","0","0","0","0","0","0","0","0","0","1","0","0","0","0","0","0","0","0","0"
"No","27-JUN-25","26-JUN-25","16:30:00Z","TEMPLE","TEXAS","UNITED STATES","AIRCRAFT EXPERIENCED ENGINE ISSUES AND CRASHED INTO TREES, TEMPLE, TX.","INCIDENT","SAN ANTONIO FSDO","N258CM","","","COSTRUZIONI AERONAUTICHE TECNA","P2010","No","UNKNOWN","INSTRUCTION","APPROACH (APR)","91","NONE","No","1","0","0","0","0","0","0","0","0","0","1","0","0","0","0","0","0","0","0","0"
"No","30-JUN-25","28-JUN-25","20:00:00Z","LATOUCHE ISLAND","ALASKA","UNITED STATES","AIRCRAFT ENCOUNTERED GUSTY WINDS AND HAD A MISHAP, LATOUCHE ISLAND, AK.","INCIDENT","ANCHORAGE FSDO","N55PT","","","PIPER","PA18","No","UNKNOWN","PERSONAL","EN ROUTE (ENR)","91","NONE","No","1","0","0","0","0","0","0","0","0","0","0","0","0","0","0","0","0","0","0","0"
"No","30-JUN-25","29-JUN-25","13:15:00Z","PELZER","SOUTH CAROLINA","UNITED STATES","AIRCRAFT LANDED HARD AND FLIPPED OVER, PELZER, SC.","INCIDENT","COLUMBIA FSDO","N150TP","","","CESSNA","150","No","UNKNOWN","PERSONAL","LANDING (LDG)","91","NONE","No","1","0","0","0","0","0","0","0","0","0","0","0","0","0","0","0","0","0","0","0"
"No","30-JUN-25","27-JUN-25","17:40:00Z","FORT LAUDERDALE","FLORIDA","UNITED STATES","AIRCRAFT EXPERIENCED ENGINE ISSUES,  MADE A FORCED LANDING AND SKIDDED OFF THE SIDE OF THE RUNWAY, FORT LAUDERDALE, FL.","INCIDENT","SOUTH FLORIDA FSDO","N368FS","","","MAULE","M7","No","NONE","PERSONAL","LANDING (LDG)","91","NONE","No","1","0","0","0","0","0","0","0","0","0","1","0","0","0","0","0","0","0","0","0"
"No","30-JUN-25","27-JUN-25","19:35:00Z","STATESBORO","GEORGIA","UNITED STATES","AIRCRAFT LANDED GEAR UP, STATESBORO, GA.","INCIDENT","ATLANTA FSDO","N404DP","","","BEECH","200","No","UNKNOWN","ON DEMAND","LANDING (LDG)","135","NONE","No","1","0","0","0","0","0","0","0","0","0","3","0","0","0","0","0","0","0","0","0"
"No","07-JUL-25","03-JUL-25","14:15:00Z","DELAND","FLORIDA","UNITED STATES","AIRCRAFT DEPARTED AND CRASHED IN A FIELD FOR UNKNOWN REASONS, DELAND, FL.","ACCIDENT","ORLANDO FSDO","N508K","","","EXPERIMENTAL","AVENTURA II","No","UNKNOWN","PERSONAL","TAKEOFF (TOF)","91","SERIOUS","No","0","0","1","0","0","0","0","0","0","0","0","0","0","0","0","0","0","0","0","0"
"No","07-JUL-25","03-JUL-25","13:43:00Z","BAKERSFIELD","CALIFORNIA","UNITED STATES","AIRCRAFT CRASHED WHILE ATTEMPTING AN OFF-RUNWAY LANDING, BAKERSFIELD, CA.","ACCIDENT","FRESNO FSDO","N1776D","","","CESSNA","170","No","SUBSTANTIAL","PERSONAL","LANDING (LDG)","91","SERIOUS","No","0","0","1","0","0","0","0","0","0","0","0","0","0","0","0","0","0","0","0","0"
"No","30-JUN-25","28-JUN-25","21:31:00Z","PHOENIX","ARIZONA","UNITED STATES","AIRCRAFT MADE AN EMERGENCY LANDING, PHOENIX, AZ.","INCIDENT","SCOTTSDALE FSDO","N8PB","","","AEROTECK","PITTS S-2A","No","UNKNOWN","PERSONAL","EN ROUTE (ENR)","91","UNKNOWN","No","0","0","0","0","1","0","0","0","0","0","0","0","0","0","0","0","0","0","0","0"
"No","30-JUN-25","28-JUN-25","14:37:00Z","WINSTON-SALEM","NORTH CAROLINA","UNITED STATES","AIRCRAFT EXPERIENCED AN ELECTRICAL ISSUE AND MADE A HARD LANDING ON A TAXIWAY, WINSTON-SALEM, NC.","INCIDENT","GREENSBORO FSDO","N922NH","","","EUROCOPTER","EC135","No","UNKNOWN","AMBULANCE","UNKNOWN (UNK)","135","NONE","No","1","0","0","0","0","2","0","0","0","0","0","0","0","0","0","0","0","0","0","0"
"No","30-JUN-25","28-JUN-25","18:10:00Z","WICHITA","KANSAS","UNITED STATES","AIRCRAFT VEERED OFF RUNWAY INTO THE GRASS, LEFT MAIN GEAR COLLAPSED AND STRUCK RUNWAY LIGHTS, WICHITA, KS.","INCIDENT","WICHITA FSDO","N1591V","","","CESSNA","172","No","MINOR","INSTRUCTION","LANDING (LDG)","91","NONE","No","1","0","0","0","0","0","0","0","0","0","0","0","0","0","0","0","0","0","0","0"
"No","30-JUN-25","29-JUN-25","15:04:00Z","TOOELE","UTAH","UNITED STATES","AIRCRAFT EXPERIENCED ENGINE ISSUES AND MADE A FORCED LANDING ON INTERSTATE 80, TOOELE, UT.","INCIDENT","SALT LAKE CITY FSDO","N1736T","","","PIPER","PA28","No","NONE","PERSONAL","EN ROUTE (ENR)","91","NONE","No","1","0","0","0","0","0","0","0","0","0","1","0","0","0","0","0","0","0","0","0"
"No","30-JUN-25","27-JUN-25","19:45:00Z","EL PASO","TEXAS","UNITED STATES","AIRCRAFT LANDED AND LEFT GEAR TWISTED DUE TO A LOOSE BOLT DAMAGING THE GEAR, EL PASO, TX.","INCIDENT","ALBUQUERQUE FSDO","N2696U","","","CESSNA","340","No","UNKNOWN","PERSONAL","LANDING (LDG)","91","NONE","No","1","0","0","0","0","0","0","0","0","0","1","0","0","0","0","0","0","0","0","0"
"No","30-JUN-25","27-JUN-25","15:20:00Z","ELBERTA","ALABAMA","UNITED STATES","AIRCRAFT CRASHED UNDER UNKNOWN CIRCUMSTANCES, ELBERTA, AL.","INCIDENT","ALABAMA AND NW FLORIDA FSDO","N3228B","","","PIPER","PA22","No","UNKNOWN","PERSONAL","EN ROUTE (ENR)","91","UNKNOWN","No","0","0","0","0","0","0","0","0","0","0","0","0","0","0","0","0","0","0","0","0"
"No","30-JUN-25","29-JUN-25","21:24:00Z","MEMPHIS","TENNESSEE","UNITED STATES","AIRCRAFT LOST POWER AFTER TAKEOFF AND MADE A FORCED LANDING IN A FIELD, MEMPHIS, TN.","INCIDENT","MEMPHIS FSDO","N8103Q","","","PIPER","PA28","No","UNKNOWN","PERSONAL","TAKEOFF (TOF)","91","NONE","No","1","0","0","0","0","0","0","0","0","0","1","0","0","0","0","0","0","0","0","0"
"No","30-JUN-25","29-JUN-25","16:33:00Z","WEST YELLOWSTONE","MONTANA","UNITED STATES","AIRCRAFT LANDED GEAR UP, WEST YELLOWSTONE, MT.","INCIDENT","HELENA FSDO","N9366P","","","PIPER","PA24","No","UNKNOWN","PERSONAL","LANDING (LDG)","91","NONE","No","1","0","0","0","0","0","0","0","0","0","1","0","0","0","0","0","0","0","0","0"
"No","30-JUN-25","24-JUN-25","16:00:00Z","ALABASTER","ALABAMA","UNITED STATES","AIRCRAFT LANDED AND VEERED INTO THE GRASS, WHILE ATTEMPTING TO RECOVER BECAME AIRBORNE AND CRASHED NOSE DOWN, ALABASTER, AL.","INCIDENT","ALABAMA AND NW FLORIDA FSDO","N34655","","","CESSNA","177","No","UNKNOWN","PERSONAL","LANDING (LDG)","91","NONE","No","1","0","0","0","0","0","0","0","0","0","0","0","0","0","0","0","0","0","0","0"
"No","30-JUN-25","28-JUN-25","13:57:00Z","CHANTILLY","VIRGINIA","UNITED STATES","AIRCRAFT STRUCK A BIRD AND POST FLIGHT INSPECTION REVEALED DAMAGE TO THE LEFT WING, CHANTILLY, VA.","INCIDENT","WASHINGTON FSDO","N402YX","","","EMBRAER","ERJ 170-200-LR","No","UNKNOWN","COMMERCIAL","EN ROUTE (ENR)","121","NONE","No","0","0","0","0","0","0","0","0","0","0","0","0","0","0","0","0","0","0","0","0"
"No","30-JUN-25","29-JUN-25","22:50:00Z","SANTA BARBARA","CALIFORNIA","UNITED STATES","AIRCRAFT STRUCK A BIRD, SANTA BARBARA, CA.","INCIDENT","VAN NUYS FSDO","N282SY","SKW3781","SKYWEST AIRLINES","EMBRAER","ERJ 170-200 LL","No","UNKNOWN","COMMERCIAL","LANDING (LDG)","121","NONE","No","0","0","0","0","0","0","0","0","0","0","0","0","0","0","0","0","0","0","0","0"
"No","07-JUL-25","03-JUL-25","17:30:00Z","LAS VEGAS","NEVADA","UNITED STATES","AIRCRAFT LANDED HARD AND STRUCK A SIGN RESULTING IN LOSS OF THE NOSE GEAR, LAS VEGAS, NV.","ACCIDENT","LAS VEGAS FSDO","N664G","","","MOONEY","M20K","No","SUBSTANTIAL","PERSONAL","LANDING (LDG)","91","NONE","No","1","0","0","0","0","0","0","0","0","0","2","0","0","0","0","0","0","0","0","0"
"No","07-JUL-25","03-JUL-25","13:30:00Z","MEEKER","COLORADO","UNITED STATES","AIRCRAFT GROUND LOOPED ON LANDING, MEEKER, CO.","ACCIDENT","SALT LAKE CITY FSDO","N66898","","","PIPER","PA18","No","SUBSTANTIAL","PERSONAL","LANDING (LDG)","91","NONE","No","1","0","0","0","0","0","0","0","0","0","1","0","0","0","0","0","0","0","0","0"
"No","07-JUL-25","03-JUL-25","16:57:00Z","KONA","HAWAII","UNITED STATES","AIRCRAFT DECLARED AN EMERGENCY DUE TO ENGINE ISSUES AND CRASHED ON A HIGHWAY, KONA, HI.","ACCIDENT","HONOLULU FSDO","N3261S","","","CESSNA","182","No","UNKNOWN","SKYDIVING","EN ROUTE (ENR)","91","SERIOUS","No","0","0","1","0","0","0","0","0","0","0","0","0","0","0","0","0","0","0","0","0"
"No","07-JUL-25","03-JUL-25","18:52:00Z","OXNARD","CALIFORNIA","UNITED STATES","AIRCRAFT LANDED AND INCURRED A PROP STRIKE, OXNARD, CA.","INCIDENT","VAN NUYS FSDO","N787FA","","","TEXTRON","172","No","UNKNOWN","PERSONAL","LANDING (LDG)","91","NONE","No","1","0","0","0","0","0","0","0","0","0","0","0","0","0","0","0","0","0","0","0"
